{
  "schema_version": 1,
  "catalog_id": "workspace_editor_core",
  "title": "NP-2 workspace and NP-3 editor core baseline slice",
  "baseline": {
    "reference_date": "2026-08-13",
    "timezone": "Asia/Seoul",
    "source_priority": [
      "official_help",
      "official_developer",
      "official_release",
      "approved_live_characterization"
    ],
    "live_observation": {
      "availability": "unavailable",
      "observation_state": "unknown",
      "reason": "No authorized signed-in Notion browser session was available for this catalog slice. Official pages are references only; no UI, DOM, accessibility-tree, network, or visual state was captured."
    }
  },
  "scope": {
    "phases": ["NP-2", "NP-3"],
    "catalog_completeness": "partial",
    "phase_completion_claim": false,
    "description": "First NP-0 catalog slice for workspace navigation, IAM, page lifecycle, block editing, keyboard behavior, and save-conflict characterization. It is not an exhaustive NP-2 or NP-3 inventory."
  },
  "claims": {
    "live_characterized": false,
    "differential_passed": false,
    "np2_gate_complete": false,
    "np3_gate_complete": false
  },
  "profiles": [
    { "id": "desktop_web_free_owner", "plan": "free", "role": "workspace_owner", "platform": "desktop_web", "locale": "ko-KR" },
    { "id": "desktop_web_plus_member", "plan": "plus", "role": "workspace_member", "platform": "desktop_web", "locale": "ko-KR" },
    { "id": "desktop_windows_business_member", "plan": "business", "role": "workspace_member", "platform": "desktop_app_windows", "locale": "ko-KR" },
    { "id": "desktop_macos_enterprise_admin", "plan": "enterprise", "role": "workspace_admin", "platform": "desktop_app_macos", "locale": "ko-KR" },
    { "id": "desktop_web_business_guest_editor", "plan": "business", "role": "guest_editor", "platform": "desktop_web", "locale": "ko-KR" },
    { "id": "desktop_web_business_guest_commenter", "plan": "business", "role": "guest_commenter", "platform": "desktop_web", "locale": "ko-KR" },
    { "id": "desktop_web_business_guest_viewer", "plan": "business", "role": "guest_viewer", "platform": "desktop_web", "locale": "ko-KR" },
    { "id": "mobile_web_free_owner", "plan": "free", "role": "workspace_owner", "platform": "mobile_web", "locale": "ko-KR" },
    { "id": "ios_plus_member", "plan": "plus", "role": "workspace_member", "platform": "ios_app", "locale": "ko-KR" },
    { "id": "android_plus_member", "plan": "plus", "role": "workspace_member", "platform": "android_app", "locale": "ko-KR" },
    { "id": "public_web_anonymous", "plan": "not_applicable", "role": "public_anonymous", "platform": "public_web", "locale": "ko-KR" }
  ],
  "sources": [
    {
      "id": "SRC-NOTION-SIDEBAR",
      "kind": "official_help",
      "title": "Navigate with the sidebar",
      "url": "https://www.notion.com/help/navigate-with-the-sidebar",
      "reference_date": "2026-08-13",
      "observation_state": "reference-only",
      "promotion_status": null,
      "live_observation_status": "unknown",
      "claim_summary": "The official help page describes workspace switching, sidebar sections, nesting, collapse, drag-and-drop reorganization, favorites, private pages, shared pages, teamspaces, and trash navigation."
    },
    {
      "id": "SRC-NOTION-SHARING",
      "kind": "official_help",
      "title": "Sharing and permissions",
      "url": "https://www.notion.com/help/sharing-and-permissions",
      "reference_date": "2026-08-13",
      "observation_state": "reference-only",
      "promotion_status": null,
      "live_observation_status": "unknown",
      "claim_summary": "The official help page is the reference for members, guests, page access levels, sharing, and permission behavior; no plan-role combination was exercised here."
    },
    {
      "id": "SRC-NOTION-DELETE-RESTORE",
      "kind": "official_help",
      "title": "Duplicate, delete and restore content",
      "url": "https://www.notion.com/help/duplicate-delete-and-restore-content",
      "reference_date": "2026-08-13",
      "observation_state": "reference-only",
      "promotion_status": null,
      "live_observation_status": "unknown",
      "claim_summary": "The official help page is the reference for duplicating content, moving content to trash, restoring it, and page history availability."
    },
    {
      "id": "SRC-NOTION-WRITING",
      "kind": "official_help",
      "title": "Writing and editing basics",
      "url": "https://www.notion.com/help/writing-and-editing-basics",
      "reference_date": "2026-08-13",
      "observation_state": "reference-only",
      "promotion_status": null,
      "live_observation_status": "unknown",
      "claim_summary": "The official help page describes content types, rich text, block selection, drag-and-drop, Markdown shortcuts, inline mentions, and a distinct mobile editing toolbar."
    },
    {
      "id": "SRC-NOTION-BLOCKS",
      "kind": "official_help",
      "title": "What is a block?",
      "url": "https://www.notion.com/help/what-is-a-block",
      "reference_date": "2026-08-13",
      "observation_state": "reference-only",
      "promotion_status": null,
      "live_observation_status": "unknown",
      "claim_summary": "The official help page is the block-model reference. This catalog does not infer serialization or unsupported-block round-trip behavior from it."
    },
    {
      "id": "SRC-NOTION-KEYBOARD",
      "kind": "official_help",
      "title": "Keyboard shortcuts",
      "url": "https://www.notion.com/help/keyboard-shortcuts",
      "reference_date": "2026-08-13",
      "observation_state": "reference-only",
      "promotion_status": null,
      "live_observation_status": "unknown",
      "claim_summary": "The official help page lists desktop and Markdown shortcuts and explicitly frames its instructions around English/QWERTY keyboards."
    }
  ],
  "reference_conflicts": [
    {
      "id": "RC-NP2-PERMISSION-SCOPE-001",
      "status": "open",
      "type": "scope_ambiguity",
      "scenario_ids": ["NP2-IAM-PERMISSION-001", "NP2-PAGE-RESTORE-001"],
      "source_ids": ["SRC-NOTION-SIDEBAR", "SRC-NOTION-SHARING"],
      "summary": "The sidebar reference states that moving shared content into Private removes others' access, while the sharing reference owns the broader page, guest, group, and inherited permission model. The precise cross-surface capability matrix is not fully specified by either reference alone.",
      "impact": "Do not infer search, mention, relation, comment, public-link, or API visibility from sidebar placement. Each role and surface requires authorized live characterization.",
      "blocks_status_at_or_above": "live-characterized",
      "resolution": null
    },
    {
      "id": "RC-NP3-KEYBOARD-PLATFORM-001",
      "status": "open",
      "type": "platform_variance",
      "scenario_ids": ["NP3-EDITOR-KEYBOARD-001", "NP3-EDITOR-BLOCKS-001"],
      "source_ids": ["SRC-NOTION-WRITING", "SRC-NOTION-KEYBOARD"],
      "summary": "The shortcut reference is scoped to English/QWERTY keyboards, while the writing reference describes a separate mobile toolbar and states that mobile has no slash commands. Neither source characterizes Korean IME composition across every listed platform.",
      "impact": "Desktop shortcut, mobile editing, Korean IME, focus, and caret expectations remain separate samples and cannot be generalized across profiles.",
      "blocks_status_at_or_above": "live-characterized",
      "resolution": null
    }
  ],
  "second_brain_hard_gates": [
    {
      "id": "SB-AGENT-LINK",
      "source_manifest_gate_id": "SB-AGENT-LINK",
      "title": "Second Brain Agent navigation remains available and host-adapted",
      "blocking": true,
      "applies_to_phases": ["NP-2", "NP-3"],
      "assertions": [
        "The Agent navigation entry remains available in every supported workspace profile.",
        "Navigation preserves the existing host and port adaptation contract."
      ],
      "evidence": {
        "observation_state": "unknown",
        "promotion_status": null,
        "live_characterization": "unknown",
        "differential": "unknown",
        "unverified_reason": "This catalog slice records the blocking contract but did not execute a Second Brain regression.",
        "records": []
      }
    },
    {
      "id": "SB-TEMPLATE-CREATION",
      "source_manifest_gate_id": "SB-TEMPLATE-CREATION",
      "title": "Second Brain template creation remains idempotently usable",
      "blocking": true,
      "applies_to_phases": ["NP-2", "NP-3"],
      "assertions": [
        "The template entry point remains visible.",
        "Workspace and editor changes preserve the established template creation flow."
      ],
      "evidence": {
        "observation_state": "unknown",
        "promotion_status": null,
        "live_characterization": "unknown",
        "differential": "unknown",
        "unverified_reason": "This catalog slice records the blocking contract but did not execute a Second Brain regression.",
        "records": []
      }
    },
    {
      "id": "SB-SESSION-ATTACHMENT",
      "source_manifest_gate_id": "SB-SESSION-ATTACHMENT",
      "title": "Current-page attachment to an Agent session remains explicit and temporary",
      "blocking": true,
      "applies_to_phases": ["NP-2", "NP-3"],
      "assertions": [
        "A user explicitly selects a session before attachment.",
        "Attachment does not silently publish page content or become canonical knowledge."
      ],
      "evidence": {
        "observation_state": "unknown",
        "promotion_status": null,
        "live_characterization": "unknown",
        "differential": "unknown",
        "unverified_reason": "This catalog slice records the blocking contract but did not execute a Second Brain regression.",
        "records": []
      }
    },
    {
      "id": "SB-PUBLISH-PREVIEW",
      "source_manifest_gate_id": "SB-PUBLISH-PREVIEW",